{
  "schema_version": 1,
  "run_id": "RUN-2025-12-16-0002",
  "agent_id": "gpt-5.2-codex-cli",
  "task_id": "TASK-2025-12-16-0002",
  "context": {
    "pack_id": "1cfd757eb95bdbcee9ef9eaa25e39f56285b9d2b21db4957b1ac4a7680b155e3",
    "repo_commit": "8ae6e1feeb8b01d44edd464486f332f229ebb9cd"
  },
  "changes": [
    { "path": ".ai/memory/tasks/TASK-2025-12-16-0002/meta.json", "action": "add" },
    { "path": ".ai/memory/tasks/TASK-2025-12-16-0002/body.md", "action": "add" },
    { "path": "src/fps_counter.h", "action": "modify" },
    { "path": "src/fps_counter.cpp", "action": "modify" },
    { "path": "src/overlay.cpp", "action": "modify" },
    { "path": ".ai/evidence/runs/RUN-2025-12-16-0002.agent_report.json", "action": "add" }
  ],
  "validation": [
    {
      "name": "memctl validate",
      "status": "pass",
      "command": "python .ai/tools/memctl.py validate --commit HEAD",
      "exit_code": 0
    },
    {
      "name": "memctl check-stale",
      "status": "pass",
      "command": "python .ai/tools/memctl.py check-stale --commit HEAD",
      "exit_code": 0
    },
    {
      "name": "memctl build-pack",
      "status": "pass",
      "command": "python .ai/tools/memctl.py build-pack --commit HEAD --task-id TASK-2025-12-16-0002 --out context_pack.json",
      "exit_code": 0
    },
    {
      "name": "memctl validate-pack",
      "status": "pass",
      "command": "python .ai/tools/memctl.py validate-pack --pack context_pack.json --task-id TASK-2025-12-16-0002",
      "exit_code": 0
    },
    {
      "name": "memctl unit tests",
      "status": "pass",
      "command": "python -m unittest discover -s .ai/tests -p \"test_*.py\"",
      "exit_code": 0
    },
    {
      "name": "cmake build",
      "status": "skipped",
      "reason": "CMake toolchain not available in this environment"
    }
  ],
  "memory_updates": [
    { "id": "TASK-2025-12-16-0002", "action": "add" }
  ]
}

