{
  "schema_version": 1,
  "run_id": "RUN-2025-12-16-0007",
  "agent_id": "gpt-5.2-codex-cli",
  "task_id": "TASK-2025-12-16-0007",
  "context": {
    "pack_id": "f6ea3bee7494c1137d392810cbcc8b2ec584a1eb9e509574d9e56b5c922a74b3",
    "repo_commit": "901d3db095e935e3848a26c9d48f051400904417"
  },
  "changes": [
    { "path": ".ai/memory/tasks/TASK-2025-12-16-0007/meta.json", "action": "add" },
    { "path": ".ai/memory/tasks/TASK-2025-12-16-0007/body.md", "action": "add" },
    { "path": ".github/workflows/build_windows.yml", "action": "add" },
    { "path": ".ai/memory/adr/ADR-0001-repo-first-memory/meta.json", "action": "modify" },
    { "path": ".ai/memory/constraints/CONSTRAINT-0001-ai-memory/meta.json", "action": "modify" },
    { "path": ".ai/memory/runbooks/RUNBOOK-0001-codex-cli-workflow/meta.json", "action": "modify" },
    { "path": ".ai/evidence/runs/RUN-2025-12-16-0007.agent_report.json", "action": "add" }
  ],
  "validation": [
    {
      "name": "memctl validate",
      "status": "pass",
      "command": "python .ai/tools/memctl.py validate --commit HEAD",
      "exit_code": 0
    },
    {
      "name": "memctl check-stale",
      "status": "pass",
      "command": "python .ai/tools/memctl.py check-stale --commit HEAD",
      "exit_code": 0
    },
    {
      "name": "memctl build-pack",
      "status": "pass",
      "command": "python .ai/tools/memctl.py build-pack --commit HEAD --task-id TASK-2025-12-16-0007 --out context_pack.json",
      "exit_code": 0
    },
    {
      "name": "memctl validate-pack",
      "status": "pass",
      "command": "python .ai/tools/memctl.py validate-pack --pack context_pack.json --task-id TASK-2025-12-16-0007",
      "exit_code": 0
    },
    {
      "name": "memctl unit tests",
      "status": "pass",
      "command": "python -m unittest discover -s .ai/tests -p \"test_*.py\"",
      "exit_code": 0
    }
  ],
  "memory_updates": [
    { "id": "TASK-2025-12-16-0007", "action": "add" },
    { "id": "ADR-0001", "action": "modify" },
    { "id": "CONSTRAINT-0001", "action": "modify" },
    { "id": "RUNBOOK-0001", "action": "modify" }
  ]
}

